{
  "contract_id": "malts.user-status-labels.current",
  "fallback_language": "en",
  "supported_languages": ["en", "zh-CN"],
  "labels": [
    {"code": "ACCEPTED", "en": "Accepted", "zh-CN": "已接受"},
    {"code": "ACTIVE", "en": "Active", "zh-CN": "进行中"},
    {"code": "ARCHIVED", "en": "Archived", "zh-CN": "已归档"},
    {"code": "AWAITING_CONFIRMATION", "en": "Awaiting confirmation", "zh-CN": "等待确认"},
    {"code": "BLOCKED", "en": "Blocked", "zh-CN": "已阻塞"},
    {"code": "CANCELLED", "en": "Cancelled", "zh-CN": "已取消"},
    {"code": "CANDIDATE_QUALIFIED", "en": "Candidate qualified", "zh-CN": "已通过候选资格"},
    {"code": "CONFIGURED", "en": "Configured", "zh-CN": "已配置"},
    {"code": "CONFIGURED_UNVERIFIED", "en": "Configured but not runtime-verified", "zh-CN": "已配置但尚未获得运行时验证"},
    {"code": "CORE_IMPLEMENTED", "en": "Core implemented", "zh-CN": "核心功能已实现"},
    {"code": "CREATED", "en": "Created", "zh-CN": "已创建"},
    {"code": "DONE", "en": "Done", "zh-CN": "已完成"},
    {"code": "EFFECTIVE_CONFIRMED", "en": "Effective route confirmed", "zh-CN": "有效路由已确认"},
    {"code": "EXECUTING", "en": "Executing", "zh-CN": "执行中"},
    {"code": "FAILED", "en": "Failed", "zh-CN": "已失败"},
    {"code": "GOVERNANCE_RECONCILIATION_REQUIRED", "en": "Governance reconciliation required", "zh-CN": "需要完成治理状态对账"},
    {"code": "HARD_CONSTRAINT", "en": "Hard constraint", "zh-CN": "硬约束"},
    {"code": "INHERITED", "en": "Inherited", "zh-CN": "继承"},
    {"code": "INSTALLED", "en": "Installed", "zh-CN": "已安装"},
    {"code": "IN_PROGRESS", "en": "In progress", "zh-CN": "处理中"},
    {"code": "ISOLATE_REQUIRED", "en": "Isolation required", "zh-CN": "需要隔离"},
    {"code": "LOCAL_IN_SCOPE_GAPS_REMAIN", "en": "Local in-scope gaps remain", "zh-CN": "本地范围内仍有缺口"},
    {"code": "MAJOR_TESTS_PASS", "en": "Major tests passed", "zh-CN": "主要测试已通过"},
    {"code": "NONE", "en": "None", "zh-CN": "无"},
    {"code": "NOT_CANDIDATE_QUALIFIED", "en": "Not candidate qualified", "zh-CN": "尚未通过候选资格"},
    {"code": "NOT_DISPATCHED", "en": "Not dispatched", "zh-CN": "尚未派发"},
    {"code": "NOT_IMPLEMENTED", "en": "Not implemented", "zh-CN": "尚未实施"},
    {"code": "NOT_INSTALLED", "en": "Not installed", "zh-CN": "尚未安装"},
    {"code": "NOT_RELEASED", "en": "Not released", "zh-CN": "尚未发布"},
    {"code": "NOT_RUN", "en": "Not run", "zh-CN": "尚未运行"},
    {"code": "NOT_WRITTEN", "en": "Not written", "zh-CN": "尚未写入"},
    {"code": "OPEN", "en": "Open", "zh-CN": "已开放"},
    {"code": "ORIGINAL_ENVIRONMENT_NOT_RETESTED", "en": "Original environment not retested", "zh-CN": "原案例环境未复验"},
    {"code": "PARTIAL", "en": "Partial", "zh-CN": "部分完成"},
    {"code": "PASS", "en": "Passed", "zh-CN": "已通过"},
    {"code": "PAUSED", "en": "Paused", "zh-CN": "已暂停"},
    {"code": "PLANNED", "en": "Planned", "zh-CN": "已计划"},
    {"code": "PLAN_REVISED", "en": "Plan revised", "zh-CN": "方案已修订"},
    {"code": "QUEUED", "en": "Queued", "zh-CN": "排队中"},
    {"code": "READY", "en": "Ready", "zh-CN": "已就绪"},
    {"code": "RECONCILE_REQUIRED", "en": "Reconciliation required", "zh-CN": "需要对账"},
    {"code": "RELEASED", "en": "Released", "zh-CN": "已发布"},
    {"code": "RETURNED", "en": "Returned", "zh-CN": "已返回"},
    {"code": "REWORK", "en": "Rework required", "zh-CN": "需要返工"},
    {"code": "RUNNING", "en": "Running", "zh-CN": "运行中"},
    {"code": "SATISFIED", "en": "Satisfied", "zh-CN": "验收条件已满足"},
    {"code": "SOFT_CONSTRAINT", "en": "Soft constraint", "zh-CN": "软约束"},
    {"code": "SUCCEEDED", "en": "Succeeded", "zh-CN": "已成功"},
    {"code": "SUPERSEDED", "en": "Superseded", "zh-CN": "已被取代"},
    {"code": "UNKNOWN", "en": "Unknown", "zh-CN": "未知"},
    {"code": "WARNING", "en": "Warning", "zh-CN": "警告"},
    {"code": "WS_NO_ACTIVE_PHASE", "en": "No active Phase", "zh-CN": "当前没有 active Phase"}
  ]
}
